{
  "runtime": "mobile_ios",
  "version": "1.0.0",
  "source": "manually curated",
  "practices": [
    {
      "id": "ios-001",
      "title": "Never hardcode API keys or secrets",
      "cwe": 798,
      "dimension": "security",
      "severity": "critical",
      "bad": "let apiKey = \"sk-prod-abc123xyz456\"",
      "good": "let apiKey = Bundle.main.infoDictionary?[\"API_KEY\"] as? String ?? \"\"",
      "explanation": "Hardcoded secrets in Swift files are visible in the IPA binary. Use Info.plist with build-time substitution or a keychain."
    },
    {
      "id": "ios-002",
      "title": "Never store sensitive data in UserDefaults",
      "cwe": 311,
      "dimension": "security",
      "severity": "high",
      "bad": "UserDefaults.standard.set(token, forKey: \"authToken\")",
      "good": "try Keychain.save(token, forKey: \"authToken\")",
      "explanation": "UserDefaults is stored unencrypted in a plist file. Use Keychain Services for tokens, passwords, and keys."
    },
    {
      "id": "ios-003",
      "title": "Validate server certificates — never disable ATS",
      "cwe": 295,
      "dimension": "security",
      "severity": "high",
      "bad": "<!-- Info.plist -->\n<key>NSAppTransportSecurity</key>\n<dict><key>NSAllowsArbitraryLoads</key><true/></dict>",
      "good": "// Use default ATS settings; pin certificates for sensitive endpoints\nlet session = URLSession(configuration: .default, delegate: pinningDelegate, delegateQueue: nil)",
      "explanation": "Disabling ATS allows unencrypted HTTP and opens the app to man-in-the-middle attacks. Use certificate pinning for sensitive APIs."
    },
    {
      "id": "ios-004",
      "title": "Sanitize user input before displaying in WebViews",
      "cwe": 79,
      "dimension": "security",
      "severity": "high",
      "bad": "webView.loadHTMLString(\"<p>\\(userInput)</p>\", baseURL: nil)",
      "good": "let escaped = userInput.replacingOccurrences(of: \"<\", with: \"&lt;\")\nwebView.loadHTMLString(\"<p>\\(escaped)</p>\", baseURL: nil)",
      "explanation": "Injecting unsanitized input into WebViews enables cross-site scripting. Escape HTML entities or use WKWebView content rules."
    },
    {
      "id": "ios-005",
      "title": "Use protocols to define interfaces for testability",
      "cwe": 1061,
      "dimension": "maintainability",
      "severity": "medium",
      "bad": "class OrderService {\n    let network = NetworkManager()\n    func fetchOrders() { network.get(\"/orders\") }\n}",
      "good": "protocol NetworkClient {\n    func get(_ path: String) async throws -> Data\n}\nclass OrderService {\n    let network: NetworkClient\n    init(network: NetworkClient) { self.network = network }\n}",
      "explanation": "Protocol-based dependencies enable mock injection in tests and reduce coupling between components."
    },
    {
      "id": "ios-006",
      "title": "Use extensions to organise conformances",
      "cwe": 1080,
      "dimension": "maintainability",
      "severity": "low",
      "bad": "class ProfileVC: UIViewController, UITableViewDelegate, UITableViewDataSource {\n    // all delegate methods mixed with view logic\n}",
      "good": "class ProfileVC: UIViewController { ... }\nextension ProfileVC: UITableViewDelegate { ... }\nextension ProfileVC: UITableViewDataSource { ... }",
      "explanation": "Extensions group protocol conformances separately from core logic, improving readability and navigation."
    },
    {
      "id": "ios-007",
      "title": "Use MARK comments to section large files",
      "cwe": 1059,
      "dimension": "maintainability",
      "severity": "low",
      "bad": "// 200 lines with no sections",
      "good": "// MARK: - Properties\n// MARK: - Lifecycle\n// MARK: - Actions\n// MARK: - Private Helpers",
      "explanation": "MARK comments create navigable sections in Xcode's jump bar, making large files easier to browse."
    },
    {
      "id": "ios-008",
      "title": "Keep view controllers under 300 lines",
      "cwe": 1080,
      "dimension": "maintainability",
      "severity": "medium",
      "bad": "// 500-line ViewController with networking, UI, and data logic",
      "good": "// Split into ViewModel, Coordinator, and lean ViewController",
      "explanation": "Massive view controllers are the most common iOS anti-pattern. Use MVVM or similar to separate concerns."
    },
    {
      "id": "ios-009",
      "title": "Use Result type for error handling instead of optional returns",
      "cwe": 755,
      "dimension": "reliability",
      "severity": "medium",
      "bad": "func fetchUser() -> User? {\n    // returns nil on error — caller can't distinguish \"not found\" from \"network error\"\n}",
      "good": "func fetchUser() async throws -> User {\n    // throws specific errors the caller can handle\n}\n// or: func fetchUser() -> Result<User, FetchError>",
      "explanation": "Optional return types lose error information. Use Result or throws to propagate error context."
    },
    {
      "id": "ios-010",
      "title": "Avoid force unwrap (!) — use guard let or if let",
      "cwe": 476,
      "dimension": "reliability",
      "severity": "medium",
      "bad": "let name = user.name!",
      "good": "guard let name = user.name else { return }",
      "explanation": "Force unwrap crashes at runtime if the value is nil. Use optional binding for safe access."
    },
    {
      "id": "ios-011",
      "title": "Use [weak self] in closures to prevent retain cycles",
      "cwe": 772,
      "dimension": "reliability",
      "severity": "high",
      "bad": "networkClient.fetch { data in\n    self.update(data)\n}",
      "good": "networkClient.fetch { [weak self] data in\n    self?.update(data)\n}",
      "explanation": "Strong self references in closures create retain cycles that leak memory. Use [weak self] for closures stored by other objects."
    },
    {
      "id": "ios-012",
      "title": "Handle async/await errors with do-catch",
      "cwe": 755,
      "dimension": "reliability",
      "severity": "medium",
      "bad": "func loadData() async {\n    let data = try! await fetchData()\n}",
      "good": "func loadData() async {\n    do {\n        let data = try await fetchData()\n        display(data)\n    } catch {\n        showError(error)\n    }\n}",
      "explanation": "try! crashes on errors. Always use do-catch for async operations that can fail."
    },
    {
      "id": "ios-013",
      "title": "Avoid retain cycles — use weak references for delegates",
      "cwe": 772,
      "dimension": "performance",
      "severity": "high",
      "bad": "var delegate: SomeDelegate?",
      "good": "weak var delegate: SomeDelegate?",
      "explanation": "Strong delegate references create retain cycles between parent and child objects, leaking memory. Always use weak."
    },
    {
      "id": "ios-014",
      "title": "Use lazy properties for expensive initialisations",
      "cwe": 1084,
      "dimension": "performance",
      "severity": "medium",
      "bad": "let formatter: DateFormatter = {\n    let f = DateFormatter()\n    f.dateFormat = \"yyyy-MM-dd\"\n    return f\n}()",
      "good": "lazy var formatter: DateFormatter = {\n    let f = DateFormatter()\n    f.dateFormat = \"yyyy-MM-dd\"\n    return f\n}()",
      "explanation": "Eager initialization runs even if the property is never used. lazy defers creation until first access."
    },
    {
      "id": "ios-015",
      "title": "Perform heavy work on background queues",
      "cwe": 1088,
      "dimension": "performance",
      "severity": "high",
      "bad": "func processImage(_ image: UIImage) {\n    let filtered = applyHeavyFilter(image) // blocks main thread\n    imageView.image = filtered\n}",
      "good": "func processImage(_ image: UIImage) {\n    DispatchQueue.global(qos: .userInitiated).async {\n        let filtered = applyHeavyFilter(image)\n        DispatchQueue.main.async {\n            self.imageView.image = filtered\n        }\n    }\n}",
      "explanation": "Heavy computation on the main thread freezes the UI. Use GCD or async/await with background actors."
    },
    {
      "id": "ios-016",
      "title": "Avoid creating objects in cellForRowAt — reuse and cache",
      "cwe": 1050,
      "dimension": "performance",
      "severity": "medium",
      "bad": "func tableView(_ tv: UITableView, cellForRowAt ip: IndexPath) -> UITableViewCell {\n    let formatter = DateFormatter()\n    formatter.dateFormat = \"yyyy-MM-dd\"\n    cell.label.text = formatter.string(from: item.date)\n}",
      "good": "private lazy var dateFormatter: DateFormatter = {\n    let f = DateFormatter()\n    f.dateFormat = \"yyyy-MM-dd\"\n    return f\n}()\nfunc tableView(_ tv: UITableView, cellForRowAt ip: IndexPath) -> UITableViewCell {\n    cell.label.text = dateFormatter.string(from: item.date)\n}",
      "explanation": "Creating objects per cell causes excessive allocation during scrolling. Cache formatters and heavy objects as properties."
    }
  ]
}
