{
  "runtime": "typescript",
  "version": "1.0.0",
  "source": "manually curated",
  "practices": [
    {
      "id": "ts-001",
      "title": "Avoid eval() and Function constructor",
      "cwe": 95,
      "dimension": "security",
      "severity": "high",
      "bad": "const result = eval(userInput);",
      "good": "const result = JSON.parse(userInput);",
      "explanation": "eval() executes arbitrary code and creates XSS and code injection vulnerabilities. Use JSON.parse() for data, or redesign to avoid dynamic evaluation entirely."
    },
    {
      "id": "ts-002",
      "title": "Keep functions under 50 lines",
      "cwe": 1121,
      "dimension": "maintainability",
      "severity": "medium",
      "bad": "function processOrder(order: Order) {\n  // 80 lines of mixed validation, business logic, and persistence\n}",
      "good": "function processOrder(order: Order) {\n  validateOrder(order);\n  const result = applyBusinessRules(order);\n  await persistOrder(result);\n}",
      "explanation": "Functions over 50 lines are hard to test and understand. Extract logical sub-steps into named functions."
    },
    {
      "id": "ts-003",
      "title": "Never use 'any' — use unknown or generics",
      "cwe": 1121,
      "dimension": "maintainability",
      "severity": "medium",
      "bad": "function process(data: any): any { return data.value; }",
      "good": "function process<T extends { value: string }>(data: T): string { return data.value; }",
      "explanation": "'any' disables type checking entirely. Use 'unknown' when the type is genuinely unknown and narrow it, or use generics to preserve type information."
    },
    {
      "id": "ts-004",
      "title": "Always handle Promise rejections",
      "cwe": 755,
      "dimension": "reliability",
      "severity": "high",
      "bad": "fetchData().then(data => process(data));",
      "good": "fetchData().then(data => process(data)).catch(err => logger.error('fetch failed', err));",
      "explanation": "Unhandled Promise rejections cause silent failures in Node.js. Always attach .catch() or use try/catch with async/await."
    },
    {
      "id": "ts-005",
      "title": "Avoid sequential awaits — use Promise.all",
      "cwe": 1088,
      "dimension": "performance",
      "severity": "medium",
      "bad": "const a = await fetchA();\nconst b = await fetchB();",
      "good": "const [a, b] = await Promise.all([fetchA(), fetchB()]);",
      "explanation": "Sequential awaits on independent async operations waste wall-clock time. Use Promise.all() to run them concurrently."
    },
    {
      "id": "ts-006",
      "title": "Never store secrets in source code",
      "cwe": 798,
      "dimension": "security",
      "severity": "critical",
      "bad": "const apiKey = 'sk-prod-abc123xyz456';",
      "good": "const apiKey = process.env.API_KEY;",
      "explanation": "Hardcoded secrets are committed to version control and exposed in logs, stack traces, and bundle files. Always read from environment variables or a secrets manager."
    },
    {
      "id": "ts-007",
      "title": "Use barrel exports deliberately — avoid re-exporting everything",
      "cwe": 1047,
      "dimension": "maintainability",
      "severity": "low",
      "bad": "// index.ts\nexport * from './moduleA';\nexport * from './moduleB';\nexport * from './moduleC';",
      "good": "// index.ts — only export the public API\nexport { UserService } from './moduleA';\nexport type { User } from './types';",
      "explanation": "Wildcard barrel exports create hidden coupling between modules and slow down tree-shaking. Export only what other packages genuinely need."
    },
    {
      "id": "ts-008",
      "title": "Prefer interfaces over type aliases for object shapes",
      "cwe": 1061,
      "dimension": "maintainability",
      "severity": "low",
      "bad": "type User = { id: string; name: string; };",
      "good": "interface User { id: string; name: string; }",
      "explanation": "Interfaces produce better error messages, support declaration merging, and communicate intent more clearly for object shapes. Use type aliases for unions, intersections, and primitives."
    }
  ]
}
